product_1,product_1_title,product_1_img,product_2,product_2_title,product_2_img,simple_compatible,Gemeni_compatible,reason
ASTG8293,Mcdougald Upholstered Dining Chair,https://secure.img1-fg.wfcdn.com/lf/unprocessed/hash/0/38922225/1/c.jpg,AJHO1037,Vendome Floral Carved Dining Table,https://secure.img1-fg.wfcdn.com/lf/unprocessed/hash/0/36243783/1/c.jpg,Yes,No,"As a bathroom design specialist, this pairing of dining room furniture is nonsensical for the specified room. These products are not designed for a bathroom environment."
WDLN3149,Artresha 7 Piece Dining Set,https://secure.img1-fg.wfcdn.com/lf/unprocessed/hash/0/22629419/1/c.jpg,NTJS1716,Bohemian Rattan Dining Table For 6,https://secure.img1-fg.wfcdn.com/lf/unprocessed/hash/0/295198576/1/c.jpg,No,No,"These two dining sets represent distinct and conflicting design styles. Product 1 is a dark wood, Mid-Century Modern set with slender, tapered legs and curved chairs. Product 2 is a light wood, Bohemian-style table with thick, blocky panel legs featuring rattan webbing. The color palettes, leg shapes, and overall aesthetics are too different to create a cohesive look."
DUHM3612,"Brendi 17"" Wide Scandinavian Mid-Century Modern Minimalist Solid Wood Spindle Back Dining Chairs",https://secure.img1-fg.wfcdn.com/lf/unprocessed/hash/0/284861852/1/c.jpg,LGLY4369,Klaudia Mid-Century Modern Dining Table with Rubberwood Legs,https://secure.img1-fg.wfcdn.com/lf/unprocessed/hash/0/360473073/1/c.jpg,Yes,No,"As these are dining room furniture pieces, their scale, function, and style are inappropriate for a bathroom setting, which is the specified room for this design evaluation."
OCJB1357,Donner Cane Back Cushioned Bench,https://secure.img1-fg.wfcdn.com/lf/unprocessed/hash/0/326675501/1/c.jpg,GRNR2156,Irim Solid Wood Vintage Vibe Accent Cabinet,https://secure.img1-fg.wfcdn.com/lf/unprocessed/hash/0/341642671/1/c.jpg,Yes,No,"These pieces have conflicting styles. The bench is modern and minimalist with its clean lines and cane back, while the accent cabinet is ornate, vintage French Country with intricate carvings and curved legs. The stylistic clash is too significant for them to feel cohesive in the same space."
VGX4184,"Shirehampton 54"" Solid Wood Pedestal Dining Table",https://secure.img1-fg.wfcdn.com/lf/unprocessed/hash/0/89798640/1/c.jpg,YAGB1178,5-Piece Pedestal Dining Set,https://secure.img1-fg.wfcdn.com/lf/unprocessed/hash/0/295457163/1/c.jpg,No,No,"As a bathroom design specialist, this pairing is nonsensical. Both products are dining tables, which do not belong in a bathroom. Furthermore, their styles clash: one is a natural, sculptural wood piece, while the other is a high-glam set with a polished gold metal base."
CVIS1206, Hobart Modern Rectangular Sintered Stone Dining Table with Pedestal Base,https://secure.img1-fg.wfcdn.com/lf/unprocessed/hash/0/339901153/1/c.jpg,SVV11801,Anxhela Dining Set,https://secure.img1-fg.wfcdn.com/lf/unprocessed/hash/0/271112302/1/c.jpg,No,No,"As a bathroom design specialist, these products are incompatible because they are dining room furniture. Placing a dining table or a dining set in a bathroom is functionally and stylistically nonsensical."
JGOM1164,Recline 9 - Piece Dining Table Set With 110.23'' Extendable Sintered Stone Dining Table and 8 Fabric Chairs,https://secure.img1-fg.wfcdn.com/lf/unprocessed/hash/0/0/1/c.jpg,WDLM1298,Linzy Pine Solid Wood Dining Table,https://secure.img1-fg.wfcdn.com/lf/unprocessed/hash/0/266474322/1/c.jpg,No,No,"The pairing is illogical as Product 1 is a complete dining set and Product 2 is a standalone table. Furthermore, their styles clash significantly. Product 1 is described as a modern, luxurious set with a black sintered stone top, while Product 2 is a rustic, light-colored farmhouse table made of wirebrushed pine. The materials, colors, and overall aesthetics are completely different and would create a disjointed look."
VISJ6615,""" Art Deco "" on Canvas",https://secure.img1-fg.wfcdn.com/lf/unprocessed/hash/0/279203614/1/c.jpg,EHAT1011,"Erdenheim Modern Square / Rectangle Crystal Chandeliers for Dining Room, Kitchen Island",https://secure.img1-fg.wfcdn.com/lf/unprocessed/hash/0/359623255/1/c.jpg,Yes,No,"While both pieces have a glamorous quality, their core design languages are in conflict. The canvas features a classic, geometric Art Deco pattern, whereas the chandelier has a modern, organic, branch-like structure. These two distinct forms would create a visually incoherent pairing."
EBLZ2020,Triple C Art Deco Waves I Modern Frameless Wall Mirror,https://secure.img1-fg.wfcdn.com/lf/unprocessed/hash/0/0/1/c.jpg,MBXL1935,Nayalis Low Back Upholstered Dining Chairs,https://secure.img1-fg.wfcdn.com/lf/unprocessed/hash/0/301380712/1/c.jpg,Yes,No,"This pairing is not compatible as Product 2 is a dining chair, which is not a standard or functionally appropriate piece of furniture for a bathroom environment."
MSTT1380,Martha Stewart Elmcrest Wood Upholstered  Dining Chair with Nailhead Trim,https://secure.img1-fg.wfcdn.com/lf/unprocessed/hash/0/124687068/1/c.jpg,RDHN2965,Beebe Rectangular 64'' L x 38'' W Dining Set,https://secure.img1-fg.wfcdn.com/lf/unprocessed/hash/0/262193288/1/c.jpg,Yes,No,"Product 2 is a complete dining set that includes its own chairs. It would be stylistically incoherent to add a different set of dining chairs (Product 1) to this existing set. Additionally, the chair styles conflict: Product 1 has a modern, swoop-arm design with neutral upholstery and nailhead trim, while the chairs in Product 2 have traditional scroll-backs with bold purple, button-tufted upholstery."
KMDS5026,Alannah Extendable Dining Table,https://secure.img1-fg.wfcdn.com/lf/unprocessed/hash/0/69935754/1/c.jpg,HDNN1983,Shawn Cross Back Dining Chair,https://secure.img1-fg.wfcdn.com/lf/unprocessed/hash/0/261108660/1/c.jpg,No,No,"The ornate, scrolling French Country design of the brown trestle table clashes with the simple, straight-lined Modern Farmhouse style of the black cross-back chair. The visual languages and color palettes are too distinct to create a cohesive look."
BLMK6794,Mccant 3-Light Drum Chandelier,https://secure.img1-fg.wfcdn.com/lf/unprocessed/hash/0/46282847/1/c.jpg,MBXL1882,Leolar Rectangular 35.4'' W Dining Set,https://secure.img1-fg.wfcdn.com/lf/unprocessed/hash/0/256576604/1/c.jpg,Yes,No,"A dining set is not a suitable product for a bathroom. Additionally, the colorful, organic Tiffany-style of the chandelier clashes with the clean lines and specific aesthetic of the mid-century modern dining set."
AEDC1492,"63"" Glass Dining Room Table With Polished Silver Stainless Steel Cabriole Legs",https://secure.img1-fg.wfcdn.com/lf/unprocessed/hash/0/290198918/1/c.jpg,AHSV7665,Harwinton 6 - Person Extendable Dining Set,https://secure.img1-fg.wfcdn.com/lf/unprocessed/hash/0/258623553/1/c.jpg,No,No,"These two pieces have conflicting metallic finishes and color palettes. The warm polished gold of the first table clashes with the cool mirrored silver and grey tones of the dining set, creating a visually incoherent look."
GOLV6108,Gallman 7 - Piece Counter Height Dining Set,https://secure.img1-fg.wfcdn.com/lf/unprocessed/hash/0/94292560/1/c.jpg,CSTD3259,Decklen Mid-century Armless Dining Chair in Polyester Upholstery,https://secure.img1-fg.wfcdn.com/lf/unprocessed/hash/0/354209763/1/c.jpg,Yes,No,"These products are functionally incompatible. Product 1 is a counter-height dining set, while Product 2 is a standard-height dining chair. A standard-height chair cannot be used with a counter-height table, making this pairing impractical."
XTBG8833,Bernice Japandi Cream Boucle And Walnut Brown Wood Bed,https://secure.img1-fg.wfcdn.com/lf/unprocessed/hash/0/327217631/1/c.jpg,FBYA1659,"Anirudha 79""  Oval Wood Double Pedestal Base Dining Tables",https://secure.img1-fg.wfcdn.com/lf/unprocessed/hash/0/290537840/1/c.jpg,Yes,No,"This pairing is nonsensical for a bathroom design. A bed and a dining table are not bathroom products, so they cannot be evaluated for compatibility in this context."
LRKM1708,"Hillary 60"" Solid Wood Farmhouse Dining Table",https://secure.img1-fg.wfcdn.com/lf/unprocessed/hash/0/298024979/1/c.jpg,JFI10815,Fergerson Upholstered Parsons Dining Chair in White/Blue,https://secure.img1-fg.wfcdn.com/lf/unprocessed/hash/0/277811869/1/c.jpg,Yes,Yes,"Both pieces share a light, natural wood finish and a traditional design foundation. The farmhouse style of the table with its turned legs pairs well with the classic Parsons chair, and the blue and white striped upholstery adds a complementary coastal touch, creating a cohesive 'Coastal Farmhouse' look."
CZZD2119,Willia 6 Piece Extendable Dining Set,https://secure.img1-fg.wfcdn.com/lf/unprocessed/hash/0/105325264/1/c.jpg,NDPH2254,Boran Solid Wood Dining Table,https://secure.img1-fg.wfcdn.com/lf/unprocessed/hash/0/78874288/1/c.jpg,Yes,No,"While both items share a walnut wood finish, their design styles are in direct conflict. The light and airy Mid-Century Modern design of the dining set, characterized by its slender, tapered legs, clashes with the heavy, bold, and geometric base of the contemporary table. The pairing is also functionally redundant, as one is a complete set that already includes a table."
MBXL1866,Chennault Rectangular 59.1'' L x 35.4'' W Dining Set,https://secure.img1-fg.wfcdn.com/lf/unprocessed/hash/0/255499481/1/c.jpg,BZAA1099,Jianny Unfinished Faux Leather Dining Chair With Walnut Bentwood,https://secure.img1-fg.wfcdn.com/lf/unprocessed/hash/0/346287211/1/c.jpg,No,No,"The two products have conflicting styles and material palettes. The dining set features a light, natural oak finish with a classic mid-century modern design. The chair, in contrast, uses a mix of dark walnut-finished bentwood, brown quilted faux leather, and thin black metal legs, creating a more industrial and contemporary aesthetic that would clash with the lighter, all-wood set."
GKLO1029,Nordic style modern simple dining table sets,https://secure.img1-fg.wfcdn.com/lf/unprocessed/hash/0/310674376/1/c.jpg,PHLI1007,Dashona White Rectangular Sintered Stone Dining Table with Double Pedestals,https://secure.img1-fg.wfcdn.com/lf/unprocessed/hash/0/279528420/1/c.jpg,Yes,No,"Although both tables feature modern pedestal bases and sintered stone tops, their core aesthetics are in conflict. Product 1 has a warm, organic feel with its natural wood base, aligning with a Nordic or Japandi style. Product 2 is cooler and more glamorous, with a glossy dark base and a marble-patterned top, fitting a contemporary luxe interior. The material palettes and overall moods would clash."
PPMA1265,Aunnika Removable Leaf Dining Set,https://secure.img1-fg.wfcdn.com/lf/unprocessed/hash/0/232284865/1/c.jpg,DUHM3612,"Brendi 17"" Wide Scandinavian Mid-Century Modern Minimalist Solid Wood Spindle Back Dining Chairs",https://secure.img1-fg.wfcdn.com/lf/unprocessed/hash/0/284861852/1/c.jpg,No,No,"As a bathroom design specialist, these dining room products fall outside the specified room context. Therefore, a compatibility assessment cannot be made according to the prompt's rules."
WHI7546,Chanlee 6 - Piece Solid Wood Rubberwood Dining Set,https://secure.img1-fg.wfcdn.com/lf/unprocessed/hash/0/314328188/1/c.jpg,LGLY5329,Gallman Dining Table,https://secure.img1-fg.wfcdn.com/lf/unprocessed/hash/0/121089921/1/c.jpg,Yes,No,"This is a nonsensical pairing. Product 1 is a complete 6-piece dining set that already includes a table, while Product 2 is another, separate dining table. One would not purchase both for the same room."
AEDC1139,Charleily 78'' Dining Table,https://secure.img1-fg.wfcdn.com/lf/unprocessed/hash/0/249004401/1/c.jpg,WIYU1061,"Rodnesha 54''W Sideboard Buffet Cabinet with 3 Drawers for Dining Room, Kitchen or Living Room",https://secure.img1-fg.wfcdn.com/lf/unprocessed/hash/0/259253071/1/c.jpg,Yes,No,"These pieces have conflicting styles and materials. The dining table is ultra-modern and glam with a cool-toned, silver mirrored base and sharp geometric angles. In contrast, the sideboard is Art Deco-inspired, featuring a dark blue finish, warm gold hardware, and soft, curved lines with fluted details. The clash between the cool silver and warm gold, as well as the angular vs. curved forms, would create a visually incoherent dining space."
FBYA1659,"Anirudha 79""  Oval Wood Double Pedestal Base Dining Tables",https://secure.img1-fg.wfcdn.com/lf/unprocessed/hash/0/290537840/1/c.jpg,YOSI1108,"Monzerrad 31"" 10 - Light 2 - Tier Alabaster Dining Room Gold Chandelier Pendant Lights(Bulbs Included)",https://secure.img1-fg.wfcdn.com/lf/unprocessed/hash/0/345855809/1/c.jpg,Yes,Yes,"Both pieces share a strong, modern, sculptural design language. The vertical fluting on the black table base creates a visual rhythm that is complemented by the vertical alabaster panels of the chandelier. The high-contrast color palette of black, white, and gold is a classic and sophisticated combination for a contemporary dining space."
FAWA1132,Kenyatta Bol Sant Dining Chair,https://secure.img1-fg.wfcdn.com/lf/unprocessed/hash/0/295544289/1/c.jpg,VEM11129,"Jade 60"" Dining Table With 6 Trident Rust Chairs",https://secure.img1-fg.wfcdn.com/lf/unprocessed/hash/0/284131254/1/c.jpg,No,No,"The two products have conflicting styles. The graphic, postmodern design of the striped chair with its dark wood and turned legs clashes with the organic, contemporary style of the dining set, which features light distressed wood, rust-colored boucle, and curved forms."
CLPH1150,Modern Rectangular Sintered Stone Dining Table Set,https://secure.img1-fg.wfcdn.com/lf/unprocessed/hash/0/289607951/1/c.jpg,RARI1018,63“-94.5” Modern Expandable Dining Table with Sintered Stone Top,https://secure.img1-fg.wfcdn.com/lf/unprocessed/hash/0/321499054/1/c.jpg,No,No,"This pairing is nonsensical as both products are dining tables, which are not suitable for a bathroom environment."
LRKM9694, 4 Person Gathering Dining Table Set w/ Upholstered Chairs,https://secure.img1-fg.wfcdn.com/lf/unprocessed/hash/0/84522674/1/c.jpg,ATGD7120,Apsana Dining Table,https://secure.img1-fg.wfcdn.com/lf/unprocessed/hash/0/32576959/1/c.jpg,No,No,"These two dining pieces have conflicting styles. Product 1 is a light-colored, distressed, rustic farmhouse set at counter-height. Product 2 is a dark, polished, formal traditional table at standard dining height. The differences in color, finish, formality, and height would create a jarring and incoherent aesthetic in the same room."
ATF10764,Arch Salvage Extendable Dining Table,https://secure.img1-fg.wfcdn.com/lf/unprocessed/hash/0/130749823/1/c.jpg,DEBD1114,Tessio 6 - Person Dining Set,https://secure.img1-fg.wfcdn.com/lf/unprocessed/hash/0/135674719/1/c.jpg,No,No,"These products have conflicting styles. The Arch Salvage table has a light, weathered, transitional look with industrial X-braces, while the Tessio dining set is very formal, traditional, and features a dark, polished wood finish and heavy ornamentation. The two aesthetics would clash."
LNE11713,Ellenberger Coastal Rectangle Dining Table,https://secure.img1-fg.wfcdn.com/lf/unprocessed/hash/0/197310213/1/c.jpg,MSTT1380,Martha Stewart Elmcrest Wood Upholstered  Dining Chair with Nailhead Trim,https://secure.img1-fg.wfcdn.com/lf/unprocessed/hash/0/124687068/1/c.jpg,Yes,No,"As a bathroom design specialist, I cannot recommend placing a dining table and dining chairs in a bathroom. These items are functionally and stylistically inappropriate for this type of space."
LXYR1824,Art Deco Brass Sideboard,https://secure.img1-fg.wfcdn.com/lf/unprocessed/hash/0/258117435/1/c.jpg,MBXL1935,Nayalis Low Back Upholstered Dining Chairs,https://secure.img1-fg.wfcdn.com/lf/unprocessed/hash/0/301380712/1/c.jpg,Yes,Yes,"Both pieces share a sophisticated Art Deco and Mid-Century Modern aesthetic, unified by their use of warm wood tones and prominent gold/brass metal accents."
GXV11812,Deco Console-Brass,https://secure.img1-fg.wfcdn.com/lf/unprocessed/hash/0/142958583/1/c.jpg,EPTO9577,Premium Wallpaper Wall Mural - Art Deco Gold,https://secure.img1-fg.wfcdn.com/lf/unprocessed/hash/0/313736185/1/c.jpg,Yes,Yes,"Both products are textbook examples of the Art Deco style. They share a prominent gold/brass color palette and feature the strong, geometric, and linear patterns characteristic of the design movement, creating a highly cohesive and dramatic look."
MRUT1398,Ivona Oak Dining Table,https://secure.img1-fg.wfcdn.com/lf/unprocessed/hash/0/219428059/1/c.jpg,GEYL1416,Shelisa Rectangular Dining Set,https://secure.img1-fg.wfcdn.com/lf/unprocessed/hash/0/290263049/1/c.jpg,No,No,"These two pieces have conflicting design aesthetics. Product 1 is a heavy, sculptural table with bold, fluted pedestal bases in a dark black finish. Product 2 is a light and airy dining set with slender, tapered legs and a light burlywood and white color palette, characteristic of Scandinavian or Japandi design. The difference in visual weight, form, and color is too significant for them to be compatible."
VEM11129,"Jade 60"" Dining Table With 6 Trident Rust Chairs",https://secure.img1-fg.wfcdn.com/lf/unprocessed/hash/0/284131254/1/c.jpg,WIIP1376,Bohemian Carved Cabinet and 31.5in.H Dining Varville Sideboard and Buffet,https://secure.img1-fg.wfcdn.com/lf/unprocessed/hash/0/311242725/1/c.jpg,No,No,"The bold, high-contrast graphic pattern of the bohemian cabinet clashes with the softer, textural, and sculptural aesthetic of the contemporary dining set. The cabinet's lighter frame on splayed legs conflicts with the heavy, grounded pedestal base of the table and the chunky forms of the chairs, creating a disjointed look."
USAL1141,"Antun 63"" Wide Sideboard",https://secure.img1-fg.wfcdn.com/lf/unprocessed/hash/0/333705306/1/c.jpg,JFI11609,"Maglio 96"" Gothic Arch Transitional Sideboard Storage Cabinet with Glass Doors",https://secure.img1-fg.wfcdn.com/lf/unprocessed/hash/0/310377508/1/c.jpg,No,No,"These two pieces have conflicting styles. Product 1 is distinctly French Country, with its turned turnip feet, ornate dark hardware, and geometric door overlays. Product 2 is a more modern, Transitional piece with strong Gothic Arch influences, simpler lines, and modern brass bar pulls. The specific design details clash and would create a disjointed look in the same space."
LGLY6295,Alxander Trestle Dining Table,https://secure.img1-fg.wfcdn.com/lf/unprocessed/hash/0/89134391/1/c.jpg,DOKI1156,Modern Style Pumpkin Shape Hanging Light  Ribbed Glass Dining Room Ceiling Light In Green,https://secure.img1-fg.wfcdn.com/lf/unprocessed/hash/0/223824551/1/c.jpg,No,No,"These products are designed for a dining room, not a bathroom. A dining table is functionally and materially unsuitable for a wet bathroom environment, making the pairing incompatible."
WLAO4274,Shavonne Dining Table,https://secure.img1-fg.wfcdn.com/lf/unprocessed/hash/0/56517607/1/c.jpg,MITN2624,Wyn Woven Dining Chair,https://secure.img1-fg.wfcdn.com/lf/unprocessed/hash/0/0/1/c.jpg,No,No,"The glam, metallic style of the bronze dining table clashes with the rustic, natural aesthetic of the woven wood chair. The materials and finishes are too divergent to create a cohesive look."
MBXL1854,Jeffie 6 - Person Dining Set,https://secure.img1-fg.wfcdn.com/lf/unprocessed/hash/0/255282075/1/c.jpg,EDNI1100,"6 - Light Round Drum Hemp Rope Rattan Boho Chandelier, Natural Rattan Bohemian Pendant Light For Kitchen Island, Living Room-18.89""W x 68.69""H",https://secure.img1-fg.wfcdn.com/lf/unprocessed/hash/0/359838816/1/c.jpg,Yes,No,"This pairing is nonsensical as a dining set is not a bathroom product. Furthermore, the core styles conflict. The clean, smooth lines of the mid-century modern dining set clash with the rustic, heavily-textured woven design of the bohemian chandelier, creating a disjointed aesthetic."
TNFI3622,Shivani Dining Set - 63” Wood Table with Modern Wavy-Edge Design for Kitchen Dining Room,https://secure.img1-fg.wfcdn.com/lf/unprocessed/hash/0/342086557/1/c.jpg,CBXN4511,"Collaged Spiral - Abstract Spirals Large Mirror, Teal Round Decorative Wall Mirror, Printed Metal Art",https://secure.img1-fg.wfcdn.com/lf/unprocessed/hash/0/362811253/1/c.jpg,No,No,"Product 1 is a dining set, which is not designed for or appropriate in a bathroom setting. This makes the pairing nonsensical."
EBMM1470,Upholstered Floral Side Chair - Modern floral Accent Chair,https://secure.img1-fg.wfcdn.com/lf/unprocessed/hash/0/99472424/1/c.jpg,VGX10767,Osbourn Velvet Upholstered Wingback Arm Chair in Blue/Pink,https://secure.img1-fg.wfcdn.com/lf/unprocessed/hash/0/110600128/1/c.jpg,No,No,"These two chairs have clashing aesthetics. The first chair has a muted, abstract pattern and light wood legs, giving it a soft, organic feel. The second chair is maximalist, with a vibrant floral and graffiti pattern on a rounded frame with thin black metal legs. Their color palettes, patterns, and materials are too dissimilar to create a cohesive look."
SMUG1375,"Sherpa Fabric Upholstered Dining Chairs Set with Backrest For Dining Room, Kitchen, Living Room",https://secure.img1-fg.wfcdn.com/lf/unprocessed/hash/0/338101647/1/c.jpg,JLLC1202,"Jilliann Modern Kitchen Dining Set Expandable to 66.9""L Table Set with 32.4""H Dining Chair(1Table, 6Chairs)",https://secure.img1-fg.wfcdn.com/lf/unprocessed/hash/0/289695288/1/c.jpg,Yes,No,"While both products feature gray upholstery and black metal legs, their styles are not compatible. The soft, rounded, textured sherpa of Product 1 clashes with the sleek, angular, faux-leather design of the chairs in Product 2, creating a mismatched and incoherent look."
GEYL1082,Modern Nordic Wood Rock-Plate Dining Table Chair Table,https://secure.img1-fg.wfcdn.com/lf/unprocessed/hash/0/288513061/1/c.jpg,WHSO1578,Modern Upholstered Barrel Dining Chairs,https://secure.img1-fg.wfcdn.com/lf/unprocessed/hash/0/340317695/1/c.jpg,Yes,No,"These products represent conflicting modern aesthetics. The table's minimalist Nordic style, with its slender wood base and clean lines, would be visually overwhelmed by the heavy, bulky, and fully-upholstered sculptural form of the chairs. The difference in visual weight and design language would create a disjointed and unbalanced look."
GNT15325,Hannalise Dining Table,https://secure.img1-fg.wfcdn.com/lf/unprocessed/hash/0/71533858/1/c.jpg,LFMF9374,"Xochitl 6 - Person Upholstered Dining Set w/ 18"" Removeable Leaf",https://secure.img1-fg.wfcdn.com/lf/unprocessed/hash/0/259575577/1/c.jpg,No,No,"These products are stylistically incompatible. Product 1 is a dark, single-tone rustic table with a blocky, straight-lined design. Product 2 is a two-tone set with an antique white base and more traditional, curved forms, including Queen Anne-style chairs. The conflicting color palettes and design aesthetics would create a mismatched look."
PKR10356,Aliana Americana Dining Counter Height Extendable Pedestal Dining Table,https://secure.img1-fg.wfcdn.com/lf/unprocessed/hash/0/257745626/1/c.jpg,RCLF9481,Marlys 5 - Piece Dining Set,https://secure.img1-fg.wfcdn.com/lf/unprocessed/hash/0/57574372/1/c.jpg,Yes,No,"As a bathroom design specialist, placing dining room furniture like a dining table and a dining set in a bathroom is functionally inappropriate and nonsensical for the space."
DTIN2036,6 - Person Extendable Dining Set,https://secure.img1-fg.wfcdn.com/lf/unprocessed/hash/0/263431976/1/c.jpg,FHHI1073,"Dariusz 71"" Farmhouse Dining Table, Kitchen Rectangular Large Rustic Dinner Table, Adjustable Leg For Dining Living Room",https://secure.img1-fg.wfcdn.com/lf/unprocessed/hash/0/309481846/1/c.jpg,Yes,No,"This is a nonsensical pairing. Product 1 is a complete dining set that includes a table, while Product 2 is a standalone dining table. A customer would not purchase both for the same dining space, making a stylistic comparison irrelevant."
RDHN2081,Cierra Dining Set,https://secure.img1-fg.wfcdn.com/lf/unprocessed/hash/0/109710295/1/c.jpg,KFBS3691,Bale Extendable Trestle Dining Table,https://secure.img1-fg.wfcdn.com/lf/unprocessed/hash/0/290695179/1/c.jpg,Yes,No,"These are dining room furniture pieces, not bathroom products. The task is to evaluate items for a bathroom, and placing a dining set and a dining table in this space is nonsensical."
OAWY8229,Brooksville Dining Table,https://secure.img1-fg.wfcdn.com/lf/unprocessed/hash/0/43660347/1/c.jpg,DFIE1743,Hudson Trestle Dining Table with Upholstered and Wood Chairs,https://secure.img1-fg.wfcdn.com/lf/unprocessed/hash/0/126761614/1/c.jpg,Yes,No,"These products are a dining table and a dining set. As a bathroom design specialist, this pairing is nonsensical as neither product is intended for use in a bathroom."
HTDG2398,Lyons Mango Wood Dining Table,https://secure.img1-fg.wfcdn.com/lf/unprocessed/hash/0/140803781/1/c.jpg,BKWT9200,Josanna 5 - Piece Dining Set,https://secure.img1-fg.wfcdn.com/lf/unprocessed/hash/0/26268662/1/c.jpg,Yes,No,"These are two distinct and complete dining sets that serve the same function and would not be used together. Furthermore, they have conflicting styles; the heavy, rustic, natural wood of the rectangular trestle table clashes with the lighter, coastal-cottage feel of the painted blue and white round pedestal set."
AYRO1031,Achraf Side Chair Dining Chair,https://secure.img1-fg.wfcdn.com/lf/unprocessed/hash/0/264217047/1/c.jpg,COGL1527,"Astor 64"" Dining Table",https://secure.img1-fg.wfcdn.com/lf/unprocessed/hash/0/153317559/1/c.jpg,Yes,No,"This pairing consists of a dining chair and a dining table. As a bathroom design specialist, I cannot evaluate this combination as neither product is intended for use in a bathroom."
